Название вакансии,URL,Название компании,Описание"Web-разработчик (javascript , PHP)",https://perm.hh.ru/vacancy/33796881?query=php, ПэйКипер,"Развитие внутренних информационных систем компании, веб-интерфейсов для банков-партнёров. Участие в разработке backend-части ПО PayKeeper (MySQL, PHP), интеграций... Знание современных HTML, CSS, Javascript. Опыт работы с одним из javascript-фреймворков Angular, React либо Vue.js. Знакомство с backend-разработкой..."
"Web-разработчик (javascript , PHP)",https://perm.hh.ru/vacancy/33903892?query=php, ПэйКипер,"Развитие внутренних информационных систем компании, веб-интерфейсов для банков-партнёров. Участие в разработке backend-части ПО PayKeeper (MySQL, PHP), интеграций... Знание современных HTML, CSS, Javascript. Опыт работы с одним из javascript-фреймворков Angular, React либо Vue.js. Знакомство с backend-разработкой..."
PHP-разработчик / PHP-программист,https://perm.hh.ru/vacancy/32203625?query=php, Mr.Doors,"Работа с одной корпоративной площадкой компании (CMS Битрикс). Доработка уже существующих модулей и компонентов. Легкая кастомизация типовых модулей и компонентов... Хорошее знание PHP 5.4+, знание PHP 7.x приветствуется. Навыки адаптивной кроссбраузерной верстки PHP (ООП), MySQL, JavaScript (jQuery..."
"Web-разработчик (javascript , PHP)",https://perm.hh.ru/vacancy/33903886?query=php, ПэйКипер,"Развитие внутренних информационных систем компании, веб-интерфейсов для банков-партнёров. Участие в разработке backend-части ПО PayKeeper (MySQL, PHP), интеграций... Знание современных HTML, CSS, Javascript. Опыт работы с одним из javascript-фреймворков Angular, React либо Vue.js. Знакомство с backend-разработкой..."
Web-разработчик / PHP-программист,https://perm.hh.ru/vacancy/33612883?query=php,ООО Континент,"Участие в разработке и запуск новых проектов компании. Поддержка и улучшение существующих проектов. Как плюс: Высшее образование (Middle/Senior PHP developer). Знание английского НЕ обязательно! Безупречные знания PHP. Знание языка запросов SQL, работа..."
PHP Laravel - разработчик,https://perm.hh.ru/vacancy/34345255?query=php, Amigoweb,Участвовать в разработке различных веб-проектов. Заниматься поддержкой и развитием веб-проектов. Уверенное знание Laravel. Опыт коммерческой разработки на Laravel. Уверенное знание Git.
Младший PHP-программист,https://perm.hh.ru/vacancy/33988263?query=php, Веб-интегратор Fusion,"Участие в проектной команде, сопровождение текущих проектов клиентов. Высшее образование или студент последних курсов. - Опыт программирования на PHP7. - Опыт написания запросов SQL. - Базовые знания HTML, CSS и..."
PHP-разработчик,https://perm.hh.ru/vacancy/34350841?query=php,ООО О2," Опыт коммерческой PHP-разработки - от 2-х лет. Требования к знанию PHP - опыт работы с любым PHP фреймворком, понимание ООП..."
Senior PHP developer,https://perm.hh.ru/vacancy/33993403?query=php, YES Холдинг,"Использование паттернов/шаблонов проектирования. Разрабатывать модули для существующих интернет магазинов. Профилировать и оптимизировать запросы к БД. Рефакторить существующий код.  JavaScript, jQuery. PHP 7+, опыт работы с СMS и PHP-фреймворками. MySQL, умение проектировать БД, профилировать запросы и улучшать..."
Ведущий PHP-разработчик,https://perm.hh.ru/vacancy/33742856?query=php, Кадровое агентство Юнити,"...чем 20 программистов. Разработка и развитие товарного каталога с использованием: PHP 7, Laravel. Подключение сторонних систем. Оптимизация производительности.  Уверенные знания PHP 7, PSR. Уверенные знания любого современного PHP-фреймворка, предпочтительно Laravel / Yii 2. Уверенные знания ООП, в контексте..."
Фронтенд-разработчик,https://perm.hh.ru/vacancy/34235953?query=php,ООО МЕДСИМПЛ,Участие в командной разработке. Участие в проектировании архитектуры приложения (фронтальная часть). Глубокое понимание возможностей современных браузеров. Интеграция со сторонними сервисами... Знание английского языка на уровне чтения технической документации. Знакомство с Symfony. Умение правильно и полно взаимодействовать с PHP.
PHP разработчик (Middle),https://perm.hh.ru/vacancy/26408438?query=php, Movavi,"Обеспечивать отказоустойчивость проектов. Проектировать и реализовывать GEO-распределенные системы. Сопровождать и развивать микросервисную архитектуру. Интегрировать с внешними системами (системы рассылки... Опыт работы на подобной позиции от 1-го года. Уверенные знания PHP. Знания любого современного PHP-фреймворка (Symfony, Laravel, Zend). "
Web-разработчик Bitrix,https://perm.hh.ru/vacancy/34133276?query=php,ООО АВД,"Разработка промо проектов. Доработка существующих проектов (преимущественно back-end). Хорошее знание HTML, CSS, JS, jQuery (без верстки). Умение пользоваться git'ом. Работа исключительно в phpstorm. Опыт работы с CMS..."
PHP программист,https://perm.hh.ru/vacancy/33711730?query=php,ООО Кельник Студиос,Проектирование и сборка новых проектов на базе 1С Битрикс / Битрикс 24. Модернизация и поддержка текущих проектов. Участие в развитии... Опыт работы с PHP 5/7 в связке с БД (MySQL) не менее года. Понимание ООП и знание нескольких паттернов...
Senior PHP Developer/ программист,https://perm.hh.ru/vacancy/34364923?query=php,ООО БелВиДжи,"Помощь в подготовке к сертификации Magento и PHP. Профилирование кода. CI/CD. Организация очередей с RabbitMQ. Опыт работы с Linux (Ubuntu, CentOS). Глубокое знание PHP5.6/PHP7, отладка, плюсы/минусы языка. Понимание принципов ООП..."
PHP программист,https://perm.hh.ru/vacancy/33678390?query=php, Випсервис,Интеграция с внутренними ресурсами компании (система обращений). Интеграция с партнёрскими системами (SOAP API). Реализация интерфейсов backend-сервиса (JavaScript). Документирование (apiDoc). Знание одного из фреймворков Yii2 / Laravel. Опыт работы с SOAP. Опыт в Node.JS. Знание основ CI/CD. 
"Backend-разработчик (PHP, Node.js, Go, Python)",https://perm.hh.ru/vacancy/34180959?query=php, kt.team,"Разрабатывать высоконагруженные ecommerce, B2B проекты. Разрабатывать REST и GraphQL API на Magento и Akeneo, Bitrix для сервисов и... Опыт работы с PHP 5/7 и одним из современных фреймворков: Zend, Symfony, Yii, Laravel. Знание принципов ООП, MVC. "
PHP разработчик Yii,https://perm.hh.ru/vacancy/34331844?query=php, TeamHotels,"Написание и поддержка проектов на фреймворке Yii2 + Vue.js. Работа со сторонними API. Разработка новых модулей, рефакторинг кода.  Опыт от 1 года . Понимание ООП и MVC. Знания PHP 7, JS, MySQL, PostgreSql, PJAX, SPA. Навык быстрого включения в..."
Ученик веб-разработчик,https://perm.hh.ru/vacancy/34296795?query=php,ООО Дунайс Альянс,"Готов изучать новые технологии, не останавливаясь на достигнутом? У тебя есть определенные знания в сфере web-разработки, но ещё не. Приходилось применять их на практике? —JavaScript. —"
Backend-разработчик,https://perm.hh.ru/vacancy/34378529?query=php,ООО Цифровая ипотека,"Интеграция с банковскими продуктами. Интеграция с CRM-системами застройщиков. Развитие функциональности платформы. PHP 7, ООП желательно Symfony, но подойдёт и Laravel. PostgreSQL/MySQL. Написание модульных и интеграционных тестов. Опыт реализации долгоживущих приложений..."
Веб-разработчик,https://perm.hh.ru/vacancy/34022212?query=php,ТОО Bilim Media Group,"Книжная полка с профессиональной литературой. Требования: Знание современных стандартов и методов разработки веб-приложений. Глубокое знание PHP, его динамики развития. Хорошее знание Front-end технологий..."
Php программист,https://perm.hh.ru/vacancy/34197072?query=php,ООО Медиа Лэнд,"Разработка новых и поддержка существующих web-проектов компании. Создание простых интерфейсов для пользователей и администраторов. Отличное знание PHP и всех нюансов версий 7.х. Опыт работы с любым из фв Laravel, Symfony, Yii. "
Программист PHP / PHP Developer,https://perm.hh.ru/vacancy/34223869?query=php, X-Cart (ООО Креативные Технологии)," Знание PHP, ООП. MySQL. JS (jQuery и подобные фреймворки), HTML, CSS соответственно. GIT, Bugtracker. Английский — уверенное чтение и перевод технического..."
Программист PHP/ Web программист,https://perm.hh.ru/vacancy/34249995?query=php, Юверст,"Разработка современных решений на современных языках программирования. Работа с базами данных, написание запросов. Знание HTML‚ PHP, CSS, JS, AJAX, XML, JSON. Опыт разработки на PHP, MySQL или альтернативные варианты. Фраймворки любые."
Junior Developer WordPress,https://perm.hh.ru/vacancy/31479427?query=php, Abelohost BV,"...занимается разработкой и поддержкой сайтов на разных CMS. Преимущественно разработка ведётся на WordPress, но иногда встречаются и кастомные PHP скрипты. Работать с кастомными PHP скриптами. - Уметь оптимизировать работу сайтов. - Желание работать и развиваться."
PHP-программист,https://perm.hh.ru/vacancy/33739939?query=php,ООО АРКОТЕКС,"Разработка новых проектов. Доработка существующих проектов. Знание php. Знание yii2 фреймворка. Знание html, css, js (jquery), html5. Знание mysql. Опыт работы с git. "
"Веб-программист (php, Битрикс)",https://perm.hh.ru/vacancy/33550717?query=php,ООО КОЛЕСА ДАРОМ.РУ,"Высоконагруженный проект с посещаемостью до 200К пользователей в сутки. Разработка нового сайта spb.kolesa-darom.ru/ на базе CMS 1C-Битрикс... Уверенные знания CMS 1С-Битрикс. Знания основного стека веб-разработки, используемых при разработке проектов на Битриксе. Хорошие знания в..."
PHP back-end/fullstack разработчик,https://perm.hh.ru/vacancy/33708358?query=php,ООО Фаст Финанс,"Скоринг клиентов с помощью внешних сервисов (БКИ, сотовые операторы и пр.). Выдача займов. Приём оплат (наличные, безналичные и эквайринг).  Уметь соблюсти срок или вовремя сигнализировать о проблемах. Понимание PHP 7. Опыт работы с PHP фреймворками (Symfony, Laravel и др.). "
PHP Developer (Symfony),https://perm.hh.ru/vacancy/34333358?query=php,ООО ЭЙС Солюшнс,"Разработка порталов и систем автоматизации бизнес-процессов. Проектирование приложений и разработка бэкенда на php7. Участие в решении архитектурных, алгоритмических... Отличное знание PHP7. Опыт работы с фреймворками Laravel/Symfony/Yii2. Понимание принципов клиентской и серверной оптимизации. "
Backend Lead (PHP),https://perm.hh.ru/vacancy/34300124?query=php,ООО Комс,"Оценивать сроки (как свои, так и чужие). Работать в тесной связке с продуктом и лидами других команд. Создавать и пересоздавать... Знание PHP на отличном уровне. Опыт работы с SQL (у нас MySQL) и noSQL. Опыт работы с Git. "
Программист Php (интернет-магазин),https://perm.hh.ru/vacancy/34334459?query=php,ООО Looking4,"Перенести интернет-магазин с движка на Битриксе - на свой самописный движок. Работать предстоит в паре со старшим разработчиком.  Идеальный кандидат тот, кто уже данную процедуру проделывал. Уверенные знания PHP. Хорошие знания MySQL (Умение строить вложенные запросы, Понимание схем..."
PHP-программист,https://perm.hh.ru/vacancy/32508711?query=php,ООО Petshop.ru,Разработка нового функционала сайта petshop.ru и сайтов-партнеров (PHP/MySQL/PostgreSQL). Рефакторинг существующей кодовой базы. Внедрение лучших практик разработки.  Имеете опыт работы по принципам AGILE. Имеете опыт работы с нагруженными проектами.
PHP программист,https://perm.hh.ru/vacancy/34328972?query=php, ImageSpark,"Разработка и развитие существующих проектов. Храним данные в MongoDB, ClickHouse и Redis. Используем GitLab CI для тестов и деплоя.  "
PHP-разработчик,https://perm.hh.ru/vacancy/30483402?query=php,ООО НАГ,"Сопровождение и совершенствование текущих проектов компании. Участие в разработке новых проектов. Разработка разнообразных проектов от web-сайтов до CRM-систем. Обладающий знаниями PHP (5, 7), HTML, CSS. С опытом работы с хотя бы с одним из фреймворков - symfony, yii, laravel. "
Старший php-разработчик (Senior PHP Developer),https://perm.hh.ru/vacancy/33438450?query=php, Shiptor,"Инструменты сборки проектов: webpack, grunt. Работа с API: REST, JsonRPC. CI/CD (Jenkins, GitLab CI/CD, etc). Качественное оборудование. Понимание ООП, паттернов и шаблонов проектирования, уметь применять их на практике. Опыт работы с одним из фреймворков от 3 лет..."
Web-мастер по сайту компании,https://perm.hh.ru/vacancy/34212215?query=php, ID Solution,"Технические работы по сайту для наполнения контентом, разработке форм, фильтрации данных и другие направленные на развитие ресурсов. Постановка задач специалистам... ...настройка ISP Manager, умение писать простейшией SQL запросы, умение читать PHP скрипты и дорабатывать, CSS, минимальные навыки работы с Linux..."
PHP-разработчик (Yii/Symfony),https://perm.hh.ru/vacancy/34144170?query=php,ООО MACHINEHEADS," Опыт коммерческой разработки на одном из фреймворков: Symfony 2+, Yii2. — Продвинутый уровень PHP и SQL. — Знание JS и..."
Стажер-программист (PHP),https://perm.hh.ru/vacancy/34272801?query=php, Effective Technologies,"Не будет монотонного обучения в лекционно-семинарском формате — только реальные задачи реального IT-проекта. Программированием и, в частности, ООП. PHP (достаточно базового уровня). Linux. СУБД (MySQL/PostgreSQL) + умение составлять простые запросы на SQL."
Web-программист,https://perm.hh.ru/vacancy/33511592?query=php,ООО ДокЛаб,"Frontend разработка. Backend разработка. Создание справочных документов по разработанному коду. HTML5‚ CSS (3.0), JavaScript, php. SVN или Git. Опыт работы в аналогичной области не менее 3 лет. "
Senior PHP backend developer (Symfony),https://perm.hh.ru/vacancy/34022958?query=php, Группа компаний eLama,"Много задач по работе с API рекламных аналитических систем (Google Ads, Google Analytics). Предстоит работать с большими Базами Данных.  Хорошее знание PHP 7. Опыт работы с Symfony 4, понимание принципов архитектуры этого фреймворка. Знание PostgreSQL, умение анализировать и ускорять..."
Backend-разработчик (PHP),https://perm.hh.ru/vacancy/34324816?query=php, «АНТ» ГРУППА КОМПАНИЙ,"Разработка сервисов платформы. Разработка API. Разработка административных интерфейсов. Уверенное знание PHP 7.x, опыт разработки от 2-х лет. Опыт работы с фреймворком Laravel / Symfony 3. "
PHP-разработчик,https://perm.hh.ru/vacancy/33928782?query=php, Star-staff," Опыт коммерческой разработки от 2 лет. Уверенное владение современными фреймворками (Yii, Symfony). Опыт работы с реляционными базами данных. "
Ведущий разработчик PHP,https://perm.hh.ru/vacancy/34355365?query=php, Национальный расчетный депозитарий,"Участие в сквозном процессе разработки, начиная с проектирования и заканчивая запуском и поддержкой. Разработка и написание кода по функциональным требованиям.  Опыт работы PHP-разработчиком не менее 5 лет. Опыт разработки фронтенда на JS и HTML, CSS. Опыт работы с PHP..."
Ведущий разработчик php/YII2,https://perm.hh.ru/vacancy/34082073?query=php,ООО Кино Стрим Групп,"Доработка существующих проектов компании согласно задачам. Помощь в решении технических проблем у партнеров при размещении рекламы на их сайтах.  Свободное владение языками программирования: PHP, JavaScript, jQuery, SQL (MySQL). Хорошее знание PHP-фреймворка Yii2 (основное), предпочтительно если знаете и..."
"Front-end разработчик / HTML-верстальщик (Junior+, Middle)",https://perm.hh.ru/vacancy/33222344?query=php," ASTRIO agency, ООО",Участие в разработке крупных проектов для российских и зарубежных клиентов. Опыт работы с CSS и JS фреймворками. Приветствуется знание PHP и знание SVN или GIT. Знание английского (на уровне чтения...
Web Developer,https://perm.hh.ru/vacancy/34062982?query=php, WineStyle,"Front-end / Back-End разработка. Проектирование архитектуры. Оптимизация. Анализ задач, ревью кода и тестирование. Опыт web-разработки от 3 лет (PHP, jQuery). Умение верстать (HTML5 и CSS3). Отличное знание MySQL (индексы, типы..."
PHP-программист (Junior+),https://perm.hh.ru/vacancy/34194438?query=php, Direct Line,"Создание сайтов на основе WordPress. Доработка сайтов, модулей и компонентов. Непрерывное получение опыта и знаний. Знание PHP. Опыт в создании WordPress сайтов от 1 года. Опыт работы с Git. "
PHP-программист,https://perm.hh.ru/vacancy/34299361?query=php,ООО Вальтрон,"Разработка новых и улучшение существующих проектов. Участие в разработке архитектуры приложения и БД. Покрытие кода тестами. Знание и практический опыт применения ООП. Опыт работы с любым современным фреймворком, желательно Yii2. Знание SQL и практический опыт..."
