Название вакансии,URL,Название компании,ОписаниеPHP-разработчик,https://perm.hh.ru/vacancy/34079849?query=php,УП Инспиратив," Очень желательный опыт, без которого на начальном этапе будет тяжело: Опыт работы с платежными системами (написание PHP модулей). "
Web-программист,https://perm.hh.ru/vacancy/34197013?query=php,ООО Сетевые Решения,"Портфолио проектов, в разработке которых было принято участие. Уверенный PHP5/7. SQL, jQuery."
Backend PHP-программист,https://perm.hh.ru/vacancy/33144272?query=php," Норд, Дом бытовой техники","Разработка нового функционала в сервис-ориентированной архитектуре. Поддержка существующих интернет-магазинов компании. Участие в обсуждении реализации задач. Умение работать в команде. Опыт программирования на PHP от 2-х лет. Базовые знания HTML, CSS (верстать не придется). "
PHP Developer,https://perm.hh.ru/vacancy/34078098?query=php,ООО Avanta / Сампад,"Реализация серверной части клиент-серверного(restful, rich client), сервис-ориентированного проекта. Основные требования к проекту: масштабируемость, 100% отказоустойчивость, высоконагруженность, работа... Опыт работы от 2-х лет, наличие успешно работающих проектов, в разработке которых принимали непосредственное участие. Опыт работы с GIT. "
PHP-программист,https://perm.hh.ru/vacancy/34135936?query=php," Вимос, торговый дом",Развитие и поддержка основного сайта компании. Web-разработка корпоративных решений для бизнеса. Верстка и программирование новых интернет проектов компании.  Уверенное знание PHP7. Уверенное знание ООП. Понимание парадигмы MVC. Работа с MYSQL умение писать сложные запросы. Работа с JS...
Ведущий PHP-разработчик (Senior PHP developer),https://perm.hh.ru/vacancy/34186349?query=php, Гринсайт,"Анализ входящих требований. Декомпозиция задач и оценка сроков их выполнения. Работа с высоконагруженными проектами. Разработка микросервисов и их поддержка.  Опыт разработки не менее 3 лет. Отличные знания PHP, MySQL, HTML, CSS, Javascript, понимание Ajax. Знакомство с фреймворками и их..."
"Backend разработчик (PHP, Yii)",https://perm.hh.ru/vacancy/33608069?query=php, Infinitiweb,"Код храним в Bitbucket. Деплоим с помощью Jenkins. Веб-сервер - nginx. Для разных задач используем разные БД: MySQL, ClickHouse, Redis... Самостоятельно продумывать архитектуру для новых модулей системы (поэтому надо разбираться в ООП и уметь применять его по делу). "
Senior PHP Developer (Symfony),https://perm.hh.ru/vacancy/30358180?query=php, DOT GROUP,"Разработка функционала проектов компании на фреймворке Symfony. Покрытие кода unit тестами. Работа только c backend. Никакого HTML, CSS, JS писать... Отличное знание PHP, MySQL, фреймворка Symfony. Соблюдение сроков и качества выполнения задач. Аккуратный, валидный код; использование современных стандартов разработки и..."
Программист PHP (ePN),https://perm.hh.ru/vacancy/34145130?query=php, FIX,"Писать чистый, тестируемый код на PHP (используем самописный фреймворк). Умение писать SQL запросы и работа с MySQL. Поддерживать и развивать... Опыт коммерческой разработки в команде — от 2 лет. Хорошие знания в PHP. Умение применять принципы ООП и паттерны проектирования. "
PHP-программист,https://perm.hh.ru/vacancy/34080038?query=php,ИП ИП Бабелян С.А.,"Умение работать с готовым движком. Писать запросы к базе данных MySQL. Поддерживать и развивать существующую кодовую базу. Писать микросервисы, воркеры... Опыт коммерческой разработки в команде — от 2 лет. Языки программирования: PHP, JS. Умение применять принципы ООП и паттерны проектирования. "
Middle PHP программист / web-разработчик,https://perm.hh.ru/vacancy/34189908?query=php," Копирка, Сеть копировальных центров","Мы хотим найти к себе в команду PHP разработчика, задачей которого будет исправление возникающих проблем и ошибок в системе, разработка... хорошее знание PHP, MySQL, Javascript, jQuery, HTML, CSS. - опыт работы с различными API. - умение работать в команде. - ответственность и исполнительность..."
Разработчик Golang/PHP (Trust&Safety),https://perm.hh.ru/vacancy/32827673?query=php, Авито,Владеете PHP или другими языками программирования. Работали с Docker/Kubernetes. Разрабатывали высоконагруженные и распределенные сервисы. Разрабатывать высокопроизводительные микросервиcы на Go.  Имеете опыт разработки на Go от 1 года. Разрабатывали многопоточные приложения. Знаете SQL и работали с реляционными БД. 
"Web Fullstack Developer (JavaScript, PHP)",https://perm.hh.ru/vacancy/33666605?query=php, Wisebits," Опыт веб-разработки не менее 3 лет. Твёрдое знание: JavaScript, PHP, MySQL. Приветствуются знания Node.js и commonjs, Redis, Memcache. "
"Web Fullstack Developer (JavaScript, PHP)",https://perm.hh.ru/vacancy/33666616?query=php, Wisebits," Опыт веб-разработки не менее 3 лет. Твёрдое знание: JavaScript, PHP, MySQL. Приветствуются знания Node.js и commonjs, Redis, Memcache. "
PHP разработчик /Backend,https://perm.hh.ru/vacancy/32072107?query=php,ООО Ю Би Эс Технологии,"Разработка сложных информационных систем и сервисов. Участие в процессе архитектурного проектирования проектов. Поддержка существующих проектов. Доработка проектов в составе команды. Умение разбираться в ""чужом"" коде. Опыт работы с PHP-фреймворком Laravel. Знание Node.js. Опыт работы (понимание принципов) в Agile команде. "
Backend разработчик PHP,https://perm.hh.ru/vacancy/34156664?query=php,ООО РЭД СММ,Верстка frontend. Работа с телеграм ботами. Написание служб (демонов) на PHP. Имеет понимание ООП. Имеет опыт работы с PHP фреймворками (желательно Laravel). Имеет понимание работы базы данных MySQL и умеет правильно...
PHP-программист,https://perm.hh.ru/vacancy/32712975?query=php,ООО ГК МИЦ,"Поддерживать и развивать корпоративный портал. Оптимизировать и рефакторить код, используя современные шаблоны и фреймворки. Обеспечить безопасность данных, хранимых на корпоративном... Хорошее знание PHP 5-7 (опыт работы от 2 лет). Понимание принципов ООП. Умение разбираться в чужом коде. Знание MySQL. "
PHP-разработчик/PHP Developer,https://perm.hh.ru/vacancy/34067335?query=php, Tophunt,"Развитие мобильного API сервиса. Разработка масштабируемых внутренних сервисов. Участие в разработке сервисной архитектуры, мы продолжаем расщеплять наш монолит на независимые... Отличное знание PHP7. Опыт работы с современными фреймворками. Опыт работы с MySQL, Redis/Memcache. Опыт работы с Linux. "
Backend-разработчик (PHP),https://perm.hh.ru/vacancy/33630107?query=php,ООО Красная рамка,"Поддержка существующих сайтов и участие в создании новых веб-проектов. Умение оценивать трудоемкость задач и укладываться в оговоренные сроки.  Опыт коммерческой разработки, разработка на PHP от 1 года. Отличное знание PHP 5.6 / PHP 7. Умение быстро разбираться в..."
Разработчик 1С Битрикс (Bitrix),https://perm.hh.ru/vacancy/34296199?query=php, MagnitMedia,Разработка и доработка проектов и сервисов на основе CMS 1C-Битрикс. Разработка модулей для 1C-Битрикс.  Хорошее владение PHP. Опыт работы с 1С Битрикс не менее 2х лет (наличие сертификатов 1С Битрикс – обязательно). 
PHP-программист,https://perm.hh.ru/vacancy/33785728?query=php,ООО Винс,"Написание кода по постановкам на создание функционала, решения поставленных задач от клиентов и других отделов. Написание своего кода, а также... ...работы с PHP. Умение работать с регулярными выражениями. Знание базовых принципов программирования. Знание сильных и слабых сторон PHP. "
Front-end/Full-stack веб-разработчик,https://perm.hh.ru/vacancy/34223650?query=php,ООО ЗИП Сервис,"Обмен между back и front посредством REST API Back Office: Apache, PHP, Firebird. 1.2 Мобильное приложение для платформ ios... Стек в проекте: Angular 7-8, CSS, JavaScript, Firebird, HTML, NodeJS, Git, PHP, Rest-api, git. Опыт: + желательно опыт..."
Front-end/Full-stack веб-разработчик,https://perm.hh.ru/vacancy/34223651?query=php,ООО ЗИП Сервис,"Обмен между back и front посредством REST API Back Office: Apache, PHP, Firebird. 1.2 Мобильное приложение для платформ ios... Стек в проекте: Angular 7-8, CSS, JavaScript, Firebird, HTML, NodeJS, Git, PHP, Rest-api, git. Опыт: + желательно опыт..."
Web-разработчик/ PHP-программист,https://perm.hh.ru/vacancy/34172063?query=php,ООО Телепорт,"Написание нового и доработка существующего функционала. Интеграция со сторонними сервисами. Проектирование и разработка REST API. PHP7. Yii2. MySQL. Опыт построения REST API. JSON API. XML. Базовые знания JS. Html5/CSS3,Jquery. "
Web программист (веб разработчик/php программист),https://perm.hh.ru/vacancy/33739815?query=php, Инком Бизнес Групп,Редактирование и оптимизация web сайтов. Профессиональные знания HTML‚ CSS. Приветствуется знания PHP‚ JS‚ MySQL. Опыт разработки и редактирования сайтов от 6 мес (рассматривается не только...
PHP программист,https://perm.hh.ru/vacancy/34020679?query=php,ТОО Alma Innovation Group,"Разработка новых и доработка существующих web-проектов на framework Yii. Уверенные знания и опыт PHP программирования‚ понимание OOP-принципов. Опыт проектирования структуры базы данных MySQL Postgres, MySQL и оптимизации запросов. "
Web-программист,https://perm.hh.ru/vacancy/34263974?query=php,АО Агростроймаш,"Участие в разработке и доработке сайтов компании. – разработка рекламной площадки. – написание грабберов и разработка Web приложений. – обновление информации (контент менеджмент... Опыт коммерческой веб разработки от 3х лет. Отличный уровень PHP (php5, php7), MySQL. Хорошее знание Laravel – опыт..."
Front-end разработчик,https://perm.hh.ru/vacancy/34252930?query=php,ООО Генеалогические системы,"участвовать в проектировании и разработке интерфейсов, UI/UX. — заниматься разработкой новых решений проекта в команде с другими разработчиками. —  Бэк: PHP — Symfony4 — ApiPlatform, Postgres — PostGIS, Redis. — опыт работы от 1 до 3 лет. — уверенное знание Javascript (ES6..."
PHP-программист 1C-Битрикс,https://perm.hh.ru/vacancy/33802585?query=php," Алютех, Группа компаний","Созданием новых сайтов на CMS 1С-Битрикс. Доработкой существующих сайтов, написанием собственных модулей. Технической поддержкой, в т.ч.  Опыт разработки на PHP не менее 2-х лет, знание принципов ООП, MVC. Способность предлагать и реализовывать архитектурные решения и..."
Middle web-разработчик (PHP),https://perm.hh.ru/vacancy/34168343?query=php,ООО Мир Хобби,"Работать над сайтами крупных интернет-магазинов. Поддерживать текущий функционал сайтов и разрабатывать новый. Уверенные навыки ООП и опыт их применения в разработке на PHP. Опыт клиентской разработки (HTML, CSS, JavaScript). Опыт работы с..."
Разработчик PHP Back-End,https://perm.hh.ru/vacancy/33709494?query=php, РУСОФТ,"Разработка серверной части, включая написание api для приложений на разных платформах. Уверенное знание PHP. Уверенное знание SQL. ООП - понимание основ, использование шаблонов проектирования. Готовность к работе в распределенной команде, нацеленность на..."
SEO-специалист/Контент-Менеджер,https://perm.hh.ru/vacancy/34181620?query=php,ООО Эко-столица,"Продвижение до 5 сайтов компании. Анализ конкурентов. Аудит сайтов, составление структуры, тз на тексты. Постановка задач и контроль web-мастеров... Базовый уровень знаний html и php. Создание, наполнение сайтов на CMS Wordpress. Умение подстраиваться под алгоритмы поисковых систем. "
Web-программист,https://perm.hh.ru/vacancy/34276796?query=php,ИП Гончаров Игорь Сергеевич,"Разработка веб приложений, сайтов, прикладных программ, возможно верстка. Знание PHP, JS, JQUERY, HTML, CSS, ООП обязательно. Знание любой CMS и framework (любого), понимание MVC - желательно. Английский (уровня чтения..."
PHP разработчик / Программист PHP,https://perm.hh.ru/vacancy/34071121?query=php, ИнСмо,"Front-end / Back-end разработка. Проектировании БД и архитектуры программных продуктов. Разработка API, по нормативу restfull. Что нужно уметь: Отличное знание PHP (5.6+) , HTML/ CSS / Javascript. Хорошее знание MySQL. Опыт с Git. "
Full stack-разработчик (Laravel/Vue),https://perm.hh.ru/vacancy/34121170?query=php,ООО ЛШ-Продакшн,"Backend: php 7.2+, Laravel/Lumen. Infrastructure: Jira, GitLab CI/CD, Docker. Frontend: Vue.js, Vuex, Nuxt.js. Storages: Postgresql, Clickhouse... Понимание асинхронной модели выполнения кода (eventloop, callbacks, promises). Работа с REST API. Умение проектировать и использовать реляционные базы данных. "
Инженер-программист (HTML/CSS/JS/PHP),https://perm.hh.ru/vacancy/33646388?query=php, Ростелеком Контакт-Центр,Основной функционал: Запуск и сопровождение проектов контакт-центра. Программирование интерфейсов операторов. Разработка отчетности по проектам (статистическая и аналитическая).  Желательно высшее образование. Необходимые навыки работы: Знание HTML/CSS/JS/PHP. Опыт работы с базами данных обязателен (MS SQL или...
PHP-программист,https://perm.hh.ru/vacancy/34109884?query=php," Новосибирский государственный медицинский университет, ФГБОУ ВО",Разработка информационной системы университета на базе фреймворка Yii. Понимание принципов ООП. Опыт разработки на языке PHP. Опыт работы с фреймворками (Yii будет плюсом). Опыт работы с MySQL (mongoDB...
Web-программист,https://perm.hh.ru/vacancy/33909483?query=php,ООО КРАСНОДАРЭЛЕКТРО,"Модернизация интернет-сайта на Bitrix. Модернизация корпоративного портала на Bitrix24. Интеграция АТС (PHP, MySQL). Образование - высшее техническое. Опыт работы в аналогичной должности от 3-х лет. Экспертное знание PHP, JavaScript, MySQL, HTML, CSS, Bitrix."
Middle/senior backend developer (PHP),https://perm.hh.ru/vacancy/33052110?query=php, ARTOX,"Проектирование архитектуры. Создание микросервисов. Работа с БД. Построение кеша и API. Поддержка существующего кода. Владеет шаблонами проектирования и следует SOLID-принципам. Уверенно знает Php 7.х. Имеет опыт использования популярных фреймворков: Yii, Laravel или..."
Middle/senior backend developer (PHP),https://perm.hh.ru/vacancy/33052306?query=php, ARTOX,"Проектирование архитектуры. Создание микросервисов. Работа с БД. Построение кеша и API. Поддержка существующего кода. Владеет шаблонами проектирования и следует SOLID-принципам. Уверенно знает Php 7.х. Имеет опыт использования популярных фреймворков: Yii, Laravel или..."
Программист-разработчик PHP (Junior developer),https://perm.hh.ru/vacancy/34143398?query=php, Live Cover Studio,"Создание различных вовлекающих механик на базе динамических обложек, чат-ботов, приложений, виджетов, масок, интерактивных трансляциях и многого другого.  PHP, Imagick/GD, MySQL, опыт работы с API VK или любым другим REST API. Знания в ООП, git, react.js, laravel..."
Web-программист,https://perm.hh.ru/vacancy/34279909?query=php,ООО Си Лайн,"1) Доработка, переработка, поддержка корпоративных сервисов и сайта компании. 2) Сопровождение сайта на Laravel. 3) Сопровождение и доработка внутренней CRM... 1) Хорошие знания PHP5/7, HTML, CSS3. 3) MySQL (MariaDB). 4) JQuery, Bootstrap."
Программист PHP Laravel,https://perm.hh.ru/vacancy/33193021?query=php, Группа компаний Simtech,"Доработка и улучшение панели управления хостингом, которая написана на PHP/Laravel. Доработка и улучшение системы биллинга (тарифы, счета и ежемесячные... Чутка HTML, CSS, JS от 2 лет. Опыт работы с современными PHP фреймворками от 1 года. Понимание консоли и DevOps..."
Программист PHP,https://perm.hh.ru/vacancy/33699428?query=php,ООО Имплант.ру,"Веб-сервисы и веб-приложения. Сайты. Порталы. Интернет-магазины. Верстка. Разработка бэкенда сайтов, веб-приложений. Администрирование Linux. Знание PHP, MySql, Linux(Ubuntu). Умение вести разработку как с нуля, так и умение входить в проект и разбираться в..."
Программист Full Stack ( Backend/Frontend PHP),https://perm.hh.ru/vacancy/33916625?query=php,ООО Эковита,"Интеграция сервисов в существующую клиентскую инфраструктуру. Настройки интеграции через GTM (Google Tag Manager). Работа с интерактивным пользовательским интерфейсом (Javascript).  Знание PHP и SQL, JavaScript; HTML, CSS. Умение разбираться в чужом коде. Опыт работы с системами контроля. Опыт разработки коммерческих..."
Senior Backend Developer (PHP),https://perm.hh.ru/vacancy/34193154?query=php, the_covert," Опыт PHP, SQL 5+ лет. Знание ООП, опыт с MVC фреймворками. Понимание структур и алгоритмов. Опыт проектирования Rest Api. "
"Программист Full-Stack (PHP / Laravel, JavaScript, React.js)",https://perm.hh.ru/vacancy/34241167?query=php,ООО «Пицца Лисицца», уверенное знание PHP7+ и опыт работы с современными фреймворками. - хорошее знание JS и понимание ES6. - 
