Название вакансии,URL,Название компании,ОписаниеWeb-разработчик,https://perm.hh.ru/vacancy/33592197?query=php,ООО ИЛ 73,"Разрабатывать и поддерживать внутреннюю CRM-систему. - Тестировать и оптимизировать код. - Проводить тесты на отказоустойчивость. ...знаете PHP5+, MySQL, HTML/CSS, JS. - Владеете ООП и любите autoload'ы. - Понимаете что такое MVC, ajax, php..."
PHP-программист (php-developer),https://perm.hh.ru/vacancy/34241292?query=php,ООО МайВед,"Разработка и поддержка модулей сайта mywed.com. Участие в определении оптимальной архитектуры WEB приложения. Разработка нового функционала в высоконагруженных системах. Опыт разработки на PHP 5 не менее 3 лет. Уметь писать сложные SQL-запросы, работать с транзакциями, оптимизировать запросы (PostgreSQL). "
PHP-программист (разработчик) на 1С-Битрикс,https://perm.hh.ru/vacancy/34126044?query=php,ООО Спортмарафон,"Поддержка и развитие внутренних проектов компании. Разработка и доработка новых модулей и компонентов для 1С-Битрикс. Понимание Архитектуры CMS ""1С-Битрикс"" и Bitrix Framework. Знания PHP, ООП, HTML‚ CSS‚ JavaScript (JQuery, Ajax, ES6)‚ MySQL. "
Программист-разработчик front-end,https://perm.hh.ru/vacancy/34343997?query=php,ООО Домсканер,"Создавать новые и дорабатывать текущие сервисы сайта, связанные с обработкой больших массивов данных собственников, их авторизацией, голосованием. Поддерживать и консультировать... Работаете с MsQL, PHP 7.x (ООП) с одним из бек-енд фреймворков (например, Laravel, Yii2, Slim), Git (GitHub)."
"TeamLead/ Senior-developer (PHP, Go)",https://perm.hh.ru/vacancy/32592539?query=php, WebMasters Russia,"Управление командой разработки. Участие в разработке новых проектов и поддержке существующих. Опыт управления командой. Опыт работы с фреймворком Laravel. Опыт работы с другими фреймворками (Yii, Symfony) будет вашим преимуществом. "
Junior Bitrix - PHP-программист,https://perm.hh.ru/vacancy/34272281?query=php,ООО СеоВен,"Поддержка и обслуживание текущих проектов. Разработка новых модулей. Верстка новых сайтов на CMS 1C-Bitrix и ModX. Знание PHP, HTML, CSS, JS. Опыт работы с 1C-Bitrix."
PHP Developer,https://perm.hh.ru/vacancy/34256252?query=php, Itransition,Участие в принятии ключевых решений и разработке архитектуры проектов для известных британских и американских брендов. Участие в процессах code verification... От 1-го года опыта работы с PHP 5-7. Знания ООП и шаблонов проектирования. Опыт работы с PHP-фреймворками...
Программист PHP (Backend),https://perm.hh.ru/vacancy/30594149?query=php, Saber Interactive,Разработка и поддержка внутренних ресурсов компании. Управление билд- процессами проектов. Знание PHP на уровне выше среднего. Использование в работе модели MVC. Использование Composer. Практический опыт использования Laravel от года. 
PHP-разработчик,https://perm.hh.ru/vacancy/34226328?query=php, R-брокер,Думать. Проектировать. Программировать. Тестировать свои творения. Пользоваться отладчиком и использовать трассировку (Xdebug). Опыт работы с Yii 1/2 или другими PHP-фреймворками. Внимание! Требуется именно разработчик...
PHP-разработчик,https://perm.hh.ru/vacancy/34226318?query=php, R-брокер,Думать. Проектировать. Программировать. Тестировать свои творения. Пользоваться отладчиком и использовать трассировку (Xdebug). Опыт работы с Yii 1/2 или другими PHP-фреймворками. Внимание! Требуется именно разработчик...
PHP-разработчик,https://perm.hh.ru/vacancy/34226321?query=php, R-брокер,Думать. Проектировать. Программировать. Тестировать свои творения. Пользоваться отладчиком и использовать трассировку (Xdebug). Опыт работы с Yii 1/2 или другими PHP-фреймворками. Внимание! Требуется именно разработчик...
PHP-разработчик,https://perm.hh.ru/vacancy/34226316?query=php, R-брокер,Думать. Проектировать. Программировать. Тестировать свои творения. Пользоваться отладчиком и использовать трассировку (Xdebug). Опыт работы с Yii 1/2 или другими PHP-фреймворками. Внимание! Требуется именно разработчик...
Web-разработчик (CMS),https://perm.hh.ru/vacancy/34219076?query=php, B2Broker Санкт-Петербург,"Web-разработка в проектной команде на CMS (WordPress, Bitrix и тд) в одном из ключевых продуктов компании. Опыт работы с Битрикс и Wordpress, а так же преимуществом будет знание modx, shop script, magento. Опыт работы с PHP..."
Backend разработчик (PHP),https://perm.hh.ru/vacancy/33707743?query=php, Zebrains,"разработка серверной части. - самостоятельный поиск решений. Самостоятельную работу над проектами без жёсткого контроля. знания PHP, MySQL (join, index, keys и т.п.). - знание хотя-бы одного из современных PHP-фреймворков (Laravel, Yii 2..."
Программист в интернет-магазин,https://perm.hh.ru/vacancy/33611219?query=php,ИП Москвичев А.Г.,"разработка сервисов сайта (в т.ч. есть задания написанные на MS Access). - базовое визуальное оформление форм (кнопок, фонов, цветов приложений... базовые знания css. - основы JS, nodeJS, php, MySQL. - обучаемость. - обязательно базовый MS Access (VBA). Обязанности: - умение читать чужой код и..."
Веб-разработчик (1С Битрикс),https://perm.hh.ru/vacancy/34347175?query=php,ООО Системэйт,"Разбираться с существующими сайтами/приложениями, выяснять принципы их работы. Дорабатывать и развивать существующие проекты. Разрабатывать новые. Заниматься отладкой и тестированием. Профессионально владеете основными веб-технологиями. Отлично знаете PHP, HTML, CSS, JS. Знаете SQL. Обладаете хорошими навыками html верстки. "
Frontend-разработчик (middle),https://perm.hh.ru/vacancy/33965699?query=php,ООО Гора Студио,"Разбивать крупные задачи на этапы и подзадачи. Качественно верстать из Sketch / InVision / Photoshop / Figma. Поддерживать существующие проекты и развивать новые.  Умеете писать Unit-тесты и знать для чего они нужны. Знаете основы backend: PHP, MySQL, PostgreSQL, docker. Знаете другие языки..."
PHP-разработчик (middle+ или senior),https://perm.hh.ru/vacancy/34282994?query=php,ООО ЭйчАрБизнесАльянс,"Разработка бекендов для e-commerce решений и написание технической документации к ним. Отличное знание PHP (5 и 7), умение разбираться в коде. Уверенное владение ООП, знание шаблонов проектирования и алгоритмов программирования. "
Go/PHP разработчик,https://perm.hh.ru/vacancy/34273476?query=php, 2ГИС,"Разрабатывать и поддерживать сервисы с различными профилями нагрузки в нескольких дата-центрах. Оптимизировать то, что работает недостаточно быстро.  Уверенное владение Go/PHP, использовать придётся оба. Опыт работы с MySQL или PostgreSQL и понимание, как работают SQL-запросы - структура..."
Frontend разработчик,https://perm.hh.ru/vacancy/34363381?query=php,ООО FURNIPRICE,"Мебельный агрегатор. Платформа для поиска и заказа мебели от производителей и продавцов со всего света с доставкой в любую точку... Требования и профессиональные навыки: Опыт от 1 года. Стек: Javascript, React, Redux, если есть React Native большой плюс. "
Full-stack web-разработчик JS/PHP,https://perm.hh.ru/vacancy/34275777?query=php, AdCombo.com,"Разработка нового функционала. Написание программного кода, исправление ошибок в имеющемся коде, оптимизация БД и запросов, сопровождение существующего кода (обязательное комментирование... Способность писать качественный, гибкий, кросс-браузерный код. Знание PHP HTML JavaScript MySQL CSS jQuery HTML5 PHP5 Git CSS..."
Веб Программист middle PHP/JS,https://perm.hh.ru/vacancy/34314883?query=php,ООО Виста,"Разработка и поддержка крупного веб продукта на Linux , медицинская информационная система ВИСТА-МЕД на - PHP и JavaScript,SOAP протокол. Хорошее знание HTML5, CSS3. Уверенное знание PHP. JavaScript, умение писать код самостоятельно и разбираться в чужом. "
PHP Developer (Full Stack),https://perm.hh.ru/vacancy/34264349?query=php, Compo,"Дополнительные инструкции. Уверенное знание PHP 7, MySQL, OOP, Composer, Design patterns в целом. Будет плюсом: навыки работы в Linux, Apache/nginx, AngularJs. "
Frontend-разработчик,https://perm.hh.ru/vacancy/34220934?query=php, Ojoteam,Ojo team — digital команда которая несет webgl и three.js в массы. Помогаем компаниям легко объяснять суть их продукта с помощью... Знание способов оптимизации производительности и потребления памяти. Знание PHP. Требовательность к качеству своего кода. Опыт работы с системами управления версиями...
GoLang разработчик,https://perm.hh.ru/vacancy/32312098?query=php,ООО Управление Бизнесом, Успешный кандидат должен обладать следующими навыками: Опыт промышленной разработки на GoLang от года. Опыт создания и настройки распределенных сервисов. 
Frontend Developer,https://perm.hh.ru/vacancy/34368530?query=php,ООО Сампад," Нативный js и JQuery. Знание PHP, MySQ. Понимание принципов SEO, Google Analytics и Яндекс.Метрике. Знание хотя бы одного: Zeplin / Invision..."
Web-разработчик / администратор корпоративного портала Битрикс24 (Bitrix24),https://perm.hh.ru/vacancy/34210684?query=php," Эспокада, компания","Документирование компонентов и модулей Битрикс 24. Поддержка и изменение существующих модулей. Проектирование и автоматизация бизнес-процессов на базе портала Битрикс... PHP, HTML5, CSS, API Bitrix, CentOs 7. Знание платформы Битрикс 24 и её особенности. Создание и настройка бизнес-процессов..."
Frontend-разработчик,https://perm.hh.ru/vacancy/33887898?query=php, Deliver,"Разработка клиентской и корпоративной части проектов компании. Взаимодействие с коллегами, обсуждение задач и внедрение новых технологических решений. Оптимизация и поиск... Релевантный опыт работы front end разработки от 3х лет. Уверенное знание JavaScript. Навыки использования JS фреймворков и библиотек (Vue..."
Web-программист,https://perm.hh.ru/vacancy/30207153?query=php,ООО Курганавтотранс,"Проект на drupal (front, back). Разработка компонентов и модулей. Подключение сторонних сервисов (api). Доработка под нужды предприятия. Техническая поддержка сайта.  Знание HTML‚ CSS, JS, jQuery, PHP, MySQL. Умение решать нестандартные задачи / разрабатывать нестандартный функционал. Умение быстро находить и исправлять ошибки..."
"Front-end Developer (JavaScript/React, Redux)",https://perm.hh.ru/vacancy/34265417?query=php, Goodwix,"Istock – PIM-система для управления продуктовой информацией. Основная задача сервиса – донести полную и достоверную информацию о товарах всем участникам рынка.  Опыт работы на React от 1 года. Отличное знание JavaScript, CSS3, HTML5, React, Redux. Понимание принципов REST. "
Web-разработчик/Веб-программист,https://perm.hh.ru/vacancy/34018155?query=php, SIMAI,"Проектирование и backend-разработка. Техническое сопровождение проектов. Оперативное обучение в процессе работы. Законченное высшее образование, желательно профильное. Знание PHP, JavaScript. Опыт работы с любой популярной CMS приветствуется. Опыт работы с CMS 1..."
Web-программист,https://perm.hh.ru/vacancy/34311701?query=php, Event.top,Создание внутренней/ внешней части сайта и внесение соответствующих правок. Взаимодействие с командой. Валидный лёгкий код. PHP фреймворки: Laravel / Yii 2 / Symfony 2. EcmaScript / Vue JS / Vuex.
Веб-программист,https://perm.hh.ru/vacancy/34077917?query=php, КликОН,"Разработка сайтов и веб-систем. HTML 5, CSS 3, JS, JQuery, XSLT, XML, SQL, PARSER, PHP, Perl, Vue, Sass, Bootstrap. 1C-Bitrix, Joomla, WP..."
"Senior PHP Developer (Full Stack), Минск",https://perm.hh.ru/vacancy/34285484?query=php,ООО Финансово-инвестиционная компания ИНХО,Backend: Frontend: Совместное время провождение. PHP. MariaDB (MySQL). HTML. React JS / Redux. Java Script Native.
Back-end разработчик,https://perm.hh.ru/vacancy/34326195?query=php, BookingBoard," Понимание и практическое применение ООП. Знание особенностей реализации ООП в PHP. Знание основ HTML, CSS. Опыт работы с SQL. "
Специалист по работе с сайтом,https://perm.hh.ru/vacancy/34167602?query=php,ООО Анкона,Ведение и наполнение имеющихся фирменных сайтов. Ведение их деятельности в соц. сетях. Навыки работы с технологической платформой MODX посредством языков программирования PHP и JavaScript. Полное погружение в проект.
Senior backend developer,https://perm.hh.ru/vacancy/33509781?query=php, ПИLКИ,"2. Планшетные проекты - ряд сервисов для использования мастерами (контроль операционной деятельности, аналитика, автоматизация внутренних бизнес-процессов) и клиентами компании (entertainment... Необходимые знания: 1. Знание и умение работать с API. 2. Знание Laravel / Lumen. 3. Знание PHP, SQL."
PHP разработчик,https://perm.hh.ru/vacancy/34239548?query=php,ООО Виликс,Разработка нового и доработка уже существующего функционала. Совместное codereview. PHP 7 (на уровне middle/middle+). RESTFull API. Желательно:
Web-разработчик,https://perm.hh.ru/vacancy/34198540?query=php, Freemake,"Участие в разработке новых web проектов. Разработка сайта компании. Разработка адаптивной и кросс-браузерной верстки. Оптимизация скорости работы на основе... Понимание принципов функционирования и построения бекэнда ( ASP .NET, PHP, Node.js). Знание HTML/CSS Polyfills. Знание CSS-фреймворков (Bootstrap). "
Web-разработчик Программист,https://perm.hh.ru/vacancy/34368758?query=php, Arkada Web Studio,"Разработка сайтов и мобильных приложений, программирование, верстка макетов. Работа на движках Joomla, WordPress, OpenCart + Битрикс. Flexbox), Кроссбраузерная верстка, Bootstrap. Навыки работы с PHP + MySQL будут преимуществом. Опыт работы с Joomla 3, WordPress, OpenCart +..."
Full Stack PHP Developer,https://perm.hh.ru/vacancy/33845383?query=php,ТОО InCraft,Разработка новых продуктов. Рефакторинг существующего кода. Понимание принципов ООП и его реализации на PHP. PHP 7 - Laravel/Symfony. ООП. Git. EcmaScript 6. MySQL. Linux. VueJs.
Ведущий Web-разработчик backend,https://perm.hh.ru/vacancy/31850265?query=php, Аксон,"Разрабатывать микросервисы на php(Symfony, API Platform). Знание PHP. - Понимание принципа работы с noSQL базами данных. - Опыт работы с ОС, основанными на Linux. - Понимание принципов работы с..."
Senior PHP программист,https://perm.hh.ru/vacancy/34002836?query=php,ООО Sales Doctor Solutions," Ранее участвовавший в больших проектах. - Глубокое знание PHP, MySQL, Postgres. - Хорошее знание JS. - Настройка и администрирование сервера. - Знание GIT. - "
"Программист PHP, JS",https://perm.hh.ru/vacancy/33221229?query=php,ООО ГУД технологии,"Применение html, css, sass. Создание собственных расширений в Google Chrome. Управление PHP-зависимостями проекта (Composer). Работа с API различных сервисов... Работа с web-хостингом, vps/vds (ssh, ftp, cron). Базовые знания PHP, JavaScript, HTML, CSS, MySQL. Желание постоянно и активно..."
PHP developer,https://perm.hh.ru/vacancy/34235291?query=php, CactusSoft,"Интересные проекты, разработка «с нуля». Опыт разработки на PHP Framework не менее 2 лет (Symfony). Опыт работы с MySQL или PostgreSQL. Полное понимание ООП, знание..."
Team Lead PHP,https://perm.hh.ru/vacancy/34259525?query=php, РЕЛЭКС,Работать с частично распределенной командой. Разрабатывать собственную CMS. Работать на проекте с долгосрочным планом развития. Свободно читает и пишет на английском языке. Имеет опыт построения архитектур сложной системы с множеством сервисов. Умеет работать с командой...
PHP-программист,https://perm.hh.ru/vacancy/34252861?query=php,ООО Генеалогические системы,"заниматься разработкой проекта в команде с другими разработчиками. — работать над серверной частью проекта. — погрузиться в сферу исторических документов и их... Бэк: PHP — Symfony4 — ApiPlatform, Postgres — PostGIS, Redis. — опыт работы от 1 до 3 лет. — хорошее знания PHP. — знание JavaScript. — "
Frontend разработчик (Middle/Senior),https://perm.hh.ru/vacancy/34018223?query=php, Ассоциация IPChain,"Разработка и поддержка существующих проектов. Создание нового функционала. Разработка веб интерфейсов системы. В приоритете кандидаты с опытом VueJS, но если готовы быстро переключиться с React или Angular тоже ок). Хорошее знание Native..."
Junior PHP-программист,https://perm.hh.ru/vacancy/34247643?query=php,ИП Михайлов Виктор,"Поддержка и улучшение интернет-магазина на Prestashop. Тематика магазина - продажа наручных часов и аксессуаров. Интеграция магазина с CRM (наша внутренняя... Знание связки PHP+MySQL, основных паттернов проектирования, ООП. Знание html+css+js. Знание системы контроля версий Git. Знание основ командной строки Unix, достаточных..."
PHP-разработчик Telecom направления,https://perm.hh.ru/vacancy/34242590?query=php," ISBC, Company","Основная задача - участие в разработке новой версии личного кабинета веб-сервиса для организации информационных и маркетинговых рассылок через СМС/MMS... ...PHP. Опыт самостоятельной разработки и запуска интернет-сайтов, веб-приложений. Понимание основных архитектурных шаблонов веб-приложений. Знакомство с современными PHP..."
